<!ELEMENT modulo (nombre*)>
<!ELEMENT nombre (contenidos*)>
    <!ATTLIST contenidos codigo CDATA #REQUIRED>
<!ELEMENT contenidos (bloque*)>
<!ELEMENT bloque (titulo, descripcion)>
<!ELEMENT titulo (#PCDATA)>
<!ELEMENT descripcion (#PCDATA)>